{
  "metric_hash": "25e88e0d2448f070ea12b1afb686989a5f00133ff2fdcbe65f838492bcc508ca",
  "quality": "complete_attested",
  "basis": "operator_attestation",
  "baseline": {
    "eligible": 1000,
    "converted": 200,
    "rate": 0.2,
    "interval": {
      "low": 0.17637709044319852,
      "high": 0.22591896464813463,
      "level": 0.95,
      "method": "wilson_descriptive"
    },
    "strata": {
      "mobile": {
        "eligible": 500,
        "converted": 100,
        "rate": 0.2,
        "interval": {
          "low": 0.16728549897175743,
          "high": 0.23728910530517394,
          "level": 0.95,
          "method": "wilson_descriptive"
        }
      },
      "desktop": {
        "eligible": 500,
        "converted": 100,
        "rate": 0.2,
        "interval": {
          "low": 0.16728549897175743,
          "high": 0.23728910530517394,
          "level": 0.95,
          "method": "wilson_descriptive"
        }
      }
    },
    "unknown_cohort_count": 0
  },
  "comparison": {
    "eligible": 1000,
    "converted": 110,
    "rate": 0.11,
    "interval": {
      "low": 0.09207937267185709,
      "high": 0.1309054989468759,
      "level": 0.95,
      "method": "wilson_descriptive"
    },
    "strata": {
      "mobile": {
        "eligible": 500,
        "converted": 10,
        "rate": 0.02,
        "interval": {
          "low": 0.010899183596210813,
          "high": 0.036420183246879345,
          "level": 0.95,
          "method": "wilson_descriptive"
        }
      },
      "desktop": {
        "eligible": 500,
        "converted": 100,
        "rate": 0.2,
        "interval": {
          "low": 0.16728549897175743,
          "high": 0.23728910530517394,
          "level": 0.95,
          "method": "wilson_descriptive"
        }
      }
    },
    "unknown_cohort_count": 0
  },
  "delta_pp": -9.000000000000002,
  "relative_change": -0.45000000000000007
}
